"Anatomical Structures, Cell Types and Biomarkers Table for Kidney v1.2",,,,,,,,,,,,,,,,,,,,,,,,,,,,,,,,,,,,,,,,,,,,,,,,,,,,,,,,,,,,,,,,,,,,,,
,,,,,,,,,,,,,,,,,,,,,,,,,,,,,,,,,,,,,,,,,,,,,,,,,,,,,,,,,,,,,,,,,,,,,,
Author Name(s):,Sanjay Jain; M. Todd Valerius; Yongqun He,,,,,,,,,,,,,,,,,,,,,,,,,,,,,,,,,,,,,,,,,,,,,,,,,,,,,,,,,,,,,,,,,,,,,
Author ORCID(s):,0000-0003-2804-127X; 0000-0001-8143-9231; 0000-0001-9189-9661,,,,,,,,,,,,,,,,,,,,,,,,,,,,,,,,,,,,,,,,,,,,,,,,,,,,,,,,,,,,,,,,,,,,,
Reviewer(s):,Blue Lake; Becky Steck; Rachel Dull; Ellen M. Quardokus ,,,,,,,,,,,,,,,,,,,,,,,,,,,,,,,,,,,,,,,,,,,,,,,,,,,,,,,,,,,,,,,,,,,,,
Reviewer ORCID(s):,0000-0002-8637-9044;0000-0001-7565-4904;0000-0002-0864-7007;0000-0001-7655-4833,,,,,,,,,,,,,,,,,,,,,,,,,,,,,,,,,,,,,,,,,,,,,,,,,,,,,,,,,,,,,,,,,,,,,
General Publication(s):,"DOI: 10.1152/physiolgenomics.00104.2020, doi: https://doi.org/10.1101/2021.07.28.454201; DOI: 10.1038/s41467-019-10861-2; DOI: 10.1172/jci.insight.133267; DOI: 10.1038/s41586-020-2941-1; DOI: 10.1016/j.devcel.2019.10.005; DOI: 10.1073/pnas.2005477117; DOI: 10.1681/ASN.2020010071; DOI: 10.1126/science.aat1699; DOI: 10.3389/fimmu.2019.02035; DOI: 10.1126/science.aat5031; DOI: 10.1084/jem.20030323; DOI: 10.1016/j.exphem.2016.10.008",,,,,,,,,,,,,,,,,,,,,,,,,,,,,,,,,,,,,,,,,,,,,,,,,,,,,,,,,,,,,,,,,,,,,
Data DOI:,https://doi.org/10.48539/HBM248.CBJV.556,,,,,,,,,,,,,,,,,,,,,,,,,,,,,,,,,,,,,,,,,,,,,,,,,,,,,,,,,,,,,,,,,,,,,
Date:,5/6/2022,,,,,,,,,,,,,,,,,,,,,,,,,,,,,,,,,,,,,,,,,,,,,,,,,,,,,,,,,,,,,,,,,,,,,
Version Number:,v1.2,,,,,,,,,,,,,,,,,,,,,,,,,,,,,,,,,,,,,,,,,,,,,,,,,,,,,,,,,,,,,,,,,,,,,
AS/1,AS/1/LABEL,AS/1/ID,AS/2,AS/2/LABEL,AS/2/ID,AS/3,AS/3/LABEL,AS/3/ID,AS/4,AS/4/LABEL,AS/4/ID,AS/5,AS/5/LABEL,AS/5/ID,CT/1,CT/1/LABEL,CT/1/ID,CT/1/ABBR,CT/1/NOTES,BGene/1,BGene/1/LABEL,BGene/1/ID,BGene/1/NOTES,BGene/2,BGene/2/LABEL,BGene/2/ID,BGene/2/NOTES,BGene/3,BGene/3/LABEL,BGene/3/ID,BGene/3/NOTES,BGene/4,BGene/4/LABEL,BGene/4/ID,BGene/5,BGene/5/LABEL,BGene/5/ID,BGene/6,BGene/6/LABEL,BGene/6/ID,BGene/7,BGene/7/LABEL,BGene/7/ID,BGene/8,BGene/8/LABEL,BGene/8/ID,FTU/1,FTU/1/LABEL,FTU/1/ID,FTU/2,FTU/2/LABEL,FTU/2/ID,REF/1,REF/1/DOI,REF/1/NOTES,REF/2,REF/2/DOI,REF/2/NOTES,REF/3,REF/3/DOI,REF/3/NOTES,REF/4,REF/4/DOI,REF/4/NOTES,REF/5,REF/5/DOI,REF/5/NOTES,REF/6,REF/6/DOI,REF/6/NOTES
kidney,kidney,UBERON:0002113,kidney capsule,kidney capsule,UBERON:0002015,,,,,,,,,,capsule mesenchymal stromal cell,,,,,Foxd1,forkhead box D1,HGNC:3802,,VSX2,,HGNC:1975,,,,,,,,,,,,,,,,,,,,,,,,,,,,DOI: 10.1371/journal.pone.0187118,"CD73, CD105, PDGFR? and ?-SMA",,,,,,,,,,,,,,,
kidney,kidney,UBERON:0002113,cortex of kidney,cortex of kidney,UBERON:0001225,outer cortex of kidney,outer cortex of kidney,UBERON:0002189,Glomerular Epithelium,glomerular epithelium,UBERON:0004188,visceral epithelial layer,glomerular visceral epithelium,UBERON:0006852,Podocyte,glomerular visceral epithelial cell,CL:0000653,,,NPHS2,"NPHS2 stomatin family member, podocin",HGNC:13394,,PODXL,,HGNC:9171,,NPHS1,,HGNC:7908,,PTPRQ,,,,,,,,,,,,,,,,,,,,,,,,,,,,,,,,,,,,,,
kidney,kidney,UBERON:0002113,cortex of kidney,cortex of kidney,UBERON:0001225,juxtamedullary cortex,juxtamedullary cortex,UBERON:0005271,Glomerular Epithelium,glomerular epithelium,UBERON:0004188,visceral epithelial layer,glomerular visceral epithelium,UBERON:0006852,Podocyte,glomerular visceral epithelial cell,CL:0000653,,,NPHS2,"NPHS2 stomatin family member, podocin",HGNC:13394,,PODXL,,HGNC:9171,,NPHS1,,HGNC:7908,,PTPRQ,,,,,,,,,,,,,,,,,,,,,,,,,,,,,,,,,,,,,,
kidney,kidney,UBERON:0002113,cortex of kidney,cortex of kidney,UBERON:0001225,medullary ray,medullary ray,UBERON:0009883,Collecting Duct (Cortex),cortical collecting duct,UBERON:0004203,,,,Cortical Collecting Duct Principal Cell,kidney cortex collecting duct principal cell,CL:1000714,,,AQP2,aquaporin 2,HGNC:634,,AQP3,,HGNC:636,,FXYD4,,,,,,,,,,,,,,,,,,,,,,,,,,,,,,,,,,,,,,,,,,
kidney,kidney,UBERON:0002113,renal medulla,renal medulla,UBERON:0000362,kidney outer medulla outer stripe,kidney outer medulla outer stripe,UBERON:0004202,Loop of Henle (Thick Limb/Medulla),thick ascending limb of loop of Henle,UBERON:0001291,,,,Medullary Thick Ascending Limb Cell,kidney loop of Henle medullary thick ascending limb epithelial cell,CL:1001108,,,SLC12A1,solute carrier family 12 member 1,HGNC:10910,,UMOD,,HGNC:12559,,CASR,,HGNC:1514,,,,,,,,,,,,,,,,,,,,,,,,,,,,,,,,,,,,,,,,
kidney,kidney,UBERON:0002113,renal medulla,renal medulla,UBERON:0000362,kidney outer medulla inner stripe,kidney outer medulla inner stripe,UBERON:0004201,Loop of Henle (Thin Limb),descending thin limb of loop of Henle,UBERON:0001289,descending thin limb of loop of Henle 2,,,Descending Thin Limb Cell Type 2,,,DTL2,,CRYAB,crystallin alpha B,HGNC:2389,,SLC39A8,,HGNC:20862,,TACSTD2,,HGNC:11530,,AQP1,,HGNC:633,SLC9A3,,HGNC:11073,,,,,,,,,,,,,,,,,,,,,,,,,,,,,,,,,
kidney,kidney,UBERON:0002113,renal medulla,renal medulla,UBERON:0000362,inner medulla of kidney,inner medulla of kidney,UBERON:0001294,Descending Vasa Recta,vasa recta descending limb,UBERON:0009202,,,,Descending Vasa Recta Endothelial Cell,vasa recta descending limb cell,CL:1001285,,,SERPINE2,serpin family E member 2,HGNC:8951,,TM4SF1,,HGNC:11853,,PALMD,,HGNC:15846,,ADAMTS6,,HGNC:222,,,,,,,,,,,,,,,,,,,,,,,,,,,,,,,,,,,,
kidney,kidney,UBERON:0002113,renal medulla,renal medulla,UBERON:0000362,inner medulla of kidney,inner medulla of kidney,UBERON:0001294,renal papilla,renal papilla,UBERON:0001228,papillary tip,tip of renal papilla,UBERON:0009095,Inner Medullary Collecting Duct Cell,kidney inner medulla collecting duct principal cell,CL:1000718,,,AQP2,aquaporin 2,HGNC:634,,SLC14A2,,HGNC:10919,,,,,,,,,,,,,,,,,,,,,,,,,,,,,,,,,,,,,,,,,,,,
kidney,kidney,UBERON:0002113,renal cortex,cortex of kidney,UBERON:0001225,renal column,renal column (column of Bertin),UBERON:0001284,Glomerular Epithelium,glomerular epithelium,UBERON:0004188,visceral epithelial layer,glomerular visceral epithelium,UBERON:0006852,Podocyte,glomerular visceral epithelial cell,CL:0000653,,,NPHS2,"NPHS2 stomatin family member, podocin",HGNC:13394,,PODXL,,HGNC:9171,,NPHS1,,HGNC:7908,,PTPRQ,,,,,,,,,,,,,,,,,,,,,,,,,,,,,,,,,,,,,,
kidney,kidney,UBERON:0002113,renal medulla,renal medulla,UBERON:0000362,renal pyramid,kidney pyramid,UBERON:0004200,Descending Vasa Recta,vasa recta descending limb,UBERON:0009202,,,,Descending Vasa Recta Endothelial Cell,vasa recta descending limb cell,CL:1001285,,,SERPINE2,serpin family E member 2,HGNC:8951,,TM4SF1,,HGNC:11853,,PALMD,,HGNC:15846,,ADAMTS6,,HGNC:222,,,,,,,,,,,,,,,,,,,,,,,,,,,,,,,,,,,,
kidney,kidney,UBERON:0002113,nephron,nephron,UBERON:0001285,Renal Corpuscle,Renal Corpuscle,UBERON:0001229,Glomerular Epithelium,glomerular epithelium,UBERON:0004188,parietal epithelial layer,glomerular parietal epithelium,UBERON:0005750,Parietal Epithelial Cell,parietal epithelial cell,CL:1000452,PEC,,VCAM1,vascular cell adhesion molecule 1,HGNC:12663,,CLDN1,,HGNC:2032,,CFH,,HGNC:4883,,CRB2,,HGNC:18688,ALDH1A2,,,,,,,,,,,,nephron,nephron,UBERON:0001285,Renal Corpuscle,Renal Corpuscle,UBERON:0001229,PMID: 31249312. PMCID: PMC6597610,DOI: 10.1038/s41467-019-10861-2,,,DOI: 10.1172/jci.insight.133267,,,DOI: 10.1038/s41467-019-10861-2,,,,,,,,,,
kidney,kidney,UBERON:0002113,nephron,nephron,UBERON:0001285,Renal Corpuscle,Renal Corpuscle,UBERON:0001229,Glomerular Epithelium,glomerular epithelium,UBERON:0004188,visceral epithelial layer,glomerular visceral epithelium,UBERON:0006852,Podocyte,glomerular visceral epithelial cell,CL:0000653,POD,,NPHS2,"NPHS2 stomatin family member, podocin",HGNC:13394,,PODXL,,HGNC:9171,,NPHS1,,HGNC:7908,,PTPRQ,,,NTNG1,,,CLIC5,,,,,,,,,nephron,nephron,UBERON:0001285,Renal Corpuscle,Renal Corpuscle,UBERON:0001229,PMID: 31249312. PMCID: PMC6597610,DOI: 10.1038/s41467-019-10861-2,,,DOI: 10.1172/jci.insight.133267,,,DOI: 10.1038/s41467-019-10861-2,,,DOI: 10.1038/s41586-020-2941-1,,,DOI: 10.1073/pnas.2005477117,,,,
kidney,kidney,UBERON:0002113,nephron,nephron,UBERON:0001285,Renal Corpuscle,Renal Corpuscle,UBERON:0001229,Glomerulus Vasculature,glomerulus vasculature,UBERON:0004190,glomerular capillary endothelium,glomerular capillary endothelium,UBERON:0004294,Glomerular Capillary Endothelial Cell,glomerular capillary endothelial cell,CL:1001005,EC-GC,,EHD3,EH domain containing 3,HGNC:3244,,EMCN,,HGNC:16041,,HECW2,,HGNC:29853,,FLT1,,HGNC:3763,AQP1,,HGNC:633,PLAT,,HGNC:9051,,,,,,,nephron,nephron,UBERON:0001285,Renal Corpuscle,Renal Corpuscle,UBERON:0001229,PMID: 31249312. PMCID: PMC6597610,DOI: 10.1038/s41467-019-10861-2,NR2F2 low / negative,,DOI: 10.1172/jci.insight.133267,,,DOI: 10.1038/s41467-019-10861-2,,,DOI: 10.1038/s41586-020-2941-1,,,DOI: 10.1038/s41467-019-12872-5,,,,
kidney,kidney,UBERON:0002113,nephron,nephron,UBERON:0001285,Renal Corpuscle,Renal Corpuscle,UBERON:0001229,Mesangium,mesangium,UBERON:0002319,glomerular mesangium,glomerular mesangium,UBERON:0002320,Mesangial Cell,glomerular mesangial cell,CL:1000742,MC,,POSTN,periostin,HGNC:16953,,PIEZO2,,HGNC:26270,,ROBO1,,HGNC:10249,,ITGA8,,HGNC:6144,PDGFRB,,HGNC:8804,SYNPO2,,HGNC:17732,,,,,,,nephron,nephron,UBERON:0001285,Renal Corpuscle,Renal Corpuscle,UBERON:0001229,PMID: 31249312. PMCID: PMC6597610,DOI: 10.1038/s41467-019-10861-2,Some markers also expressed in vascular pericytes; No ACTA2,,DOI: 10.1172/jci.insight.133267,,,DOI: 10.1038/s41467-019-10861-2,,,DOI: 10.1038/s41586-020-2941-1,,,DOI: 10.1073/pnas.2005477117,,,DOI: 10.1681/ASN.2020010071,https://esbl.nhlbi.nih.gov/KTEA/
kidney,kidney,UBERON:0002113,nephron,nephron,UBERON:0001285,Tubules,nephron tubule,UBERON:0001231,Proximal Tubule,proximal tubule,UBERON:0004134,,,,Proximal Tubule Epithelial Cell,epithelial cell of proximal tubule,CL:0002306,,,CUBN,cubilin,HGNC:2548,,LRP2,,HGNC:6694,,SLC13A1,,HGNC:10916,,ALDOB,,HGNC:417,GATM,,HGNC:4175,,,,,,,,,,nephron,nephron,UBERON:0001285,Proximal Tubule,proximal tubule,UBERON:0004134,PMID: 31249312. PMCID: PMC6597610,DOI: 10.1038/s41467-019-10861-2,,,DOI: 10.1172/jci.insight.133267,,,,,,DOI: 10.1038/s41586-020-2941-1,,,DOI: 10.1073/pnas.2005477117,,,DOI: 10.1681/ASN.2020010071,https://esbl.nhlbi.nih.gov/KTEA/
kidney,kidney,UBERON:0002113,nephron,nephron,UBERON:0001285,Tubules,nephron tubule,UBERON:0001231,Proximal Tubule,proximal tubule,UBERON:0004134,proximal convoluted tubule segment 1,proximal convoluted tubule segment 1,UBERON:0004196,Proximal Tubule Epithelial Cell Segment 1,epithelial cell of proximal tubule segment 1,CL:4030009,PT-S1,New term added CL; PTS1-S3 markers may overlap,SLC5A12,solute carrier family 5 member 12,HGNC:28750,,SLC5A2,,HGNC:11037,,SLC34A1,,HGNC:11019,,SLC22A6,,HGNC:10970,SLC22A8,,HGNC:10972,PRODH2,,HGNC:9453,,,,,,,nephron,nephron,UBERON:0001285,Proximal Tubule,proximal tubule,UBERON:0004134,PMID: 31249312. PMCID: PMC6597610,DOI: 10.1038/s41467-019-10861-2,There is overlap of markers among the PT segments,,DOI: 10.1172/jci.insight.133267,,PMID: 31689386,DOI: 10.1016/j.devcel.2019.10.005,https://cello.shinyapps.io/kidneycellexplorer/,,DOI: 10.1038/s41586-020-2941-1,,,DOI: 10.1073/pnas.2005477117,,,DOI: 10.1681/ASN.2020010071,https://esbl.nhlbi.nih.gov/KTEA/
kidney,kidney,UBERON:0002113,nephron,nephron,UBERON:0001285,Tubules,nephron tubule,UBERON:0001231,Proximal Tubule,proximal tubule,UBERON:0004134,proximal convoluted tubule segment 2,proximal convoluted tubule segment 2,UBERON:0004197,Proximal Tubule Epithelial Cell Segment 2,epithelial cell of proximal tubule segment 2,CL:4030010 ,PT-S2,New term added CL; PTS1-S3 markers may overlap,SLC5A11,solute carrier family 5 member 11,HGNC:23091,,SLC13A3,,HGNC:14430,,SLC34A1,,HGNC:11019,,SLC22A6,,HGNC:10970,SLC22A8,,HGNC:10972,ACSM2A,,HGNC:32017,,,,,,,nephron,nephron,UBERON:0001285,Proximal Tubule,proximal tubule,UBERON:0004134,PMID: 31249312. PMCID: PMC6597610,DOI: 10.1038/s41467-019-10861-2,There is overlap of markers among the PT segments; also from HuBMAP data,,DOI: 10.1172/jci.insight.133267,,PMID: 31689386,DOI: 10.1016/j.devcel.2019.10.005,https://cello.shinyapps.io/kidneycellexplorer/,,,,,DOI: 10.1073/pnas.2005477117,,,DOI: 10.1681/ASN.2020010071,https://esbl.nhlbi.nih.gov/KTEA/
kidney,kidney,UBERON:0002113,nephron,nephron,UBERON:0001285,Tubules,nephron tubule,UBERON:0001231,Proximal Tubule,proximal tubule,UBERON:0004134,proximal straight tubule segment 3,proximal straight tubule,UBERON:0001290,Proximal Tubule Cell Epithelial Segment 3,epithelial cell of proximal tubule segment 3,CL:4030011,PT-S3,New term added CL; PTS1-S3 markers may overlap,SLC22A7,solute carrier family 22 member 7,HGNC:10971,,SLC17A1,,HGNC:10929,,AQP1,,HGNC:633,,SATB2,,HGNC:21637,MOGAT1,,HGNC:18210,SLC5A11,,HGNC:23091,,,,,,,nephron,nephron,UBERON:0001285,Proximal Tubule,proximal tubule,UBERON:0004134,PMID: 31249312. PMCID: PMC6597610,DOI: 10.1038/s41467-019-10861-2,There is overlap of markers among the PT segments; also from HuBMAP data,,,,PMID: 31689386,DOI: 10.1016/j.devcel.2019.10.005,https://cello.shinyapps.io/kidneycellexplorer/,,DOI: 10.1038/s41586-020-2941-1,,,DOI: 10.1073/pnas.2005477117,,,DOI: 10.1681/ASN.2020010071,https://esbl.nhlbi.nih.gov/KTEA/
kidney,kidney,UBERON:0002113,nephron,nephron,UBERON:0001285,Tubules,nephron tubule,UBERON:0001231,Loop of Henle (Thin Limb),descending thin limb of loop of Henle,UBERON:0001289,descending thin limb of loop of Henle,descending thin limb,UBERON:0005096,Descending Thin Limb Cell,kidney loop of Henle thin descending limb epithelial cell,CL:1001111,,,CRYAB,crystallin alpha B,HGNC:2389,,SPP1,,HGNC:11255,,SATB2,,HGNC:21637,,VCAM1,,HGNC:12663,SLC44A5,,,,,,,,,,,,nephron,nephron,UBERON:0001285,Loop of Henle (Thin Limb),descending thin limb of loop of Henle,UBERON:0001289,PMID: 31249312. PMCID: PMC6597610,DOI: 10.1038/s41467-019-10861-2,CLDN10 low,,DOI: 10.1172/jci.insight.133267,,,DOI: 10.1038/s41467-019-10861-2,,,DOI: 10.1681/ASN.2020010071,https://esbl.nhlbi.nih.gov/KTEA/,,,,,,
kidney,kidney,UBERON:0002113,nephron,nephron,UBERON:0001285,Tubules,nephron tubule,UBERON:0001231,Loop of Henle (Thin Limb),descending thin limb of loop of Henle,UBERON:0001289,descending thin limb of loop of Henle 1,,,Descending Thin Limb Cell Type 1,descending thin limb cell type 1,CL:4030012,DTL1,"New term added CL; CLDN10 low. no to low AQP1, SLC9A3, SLC4A11",CRYAB,crystallin alpha B,HGNC:2389,,SPP1,,HGNC:11255,,SLC14A2,,HGNC:10919,,SATB2,,HGNC:21637,TACSTSD2,,HGNC:11530,ID1,,HGNC:5360,CPE,,HGNC:2303,JAG1,,HGNC:6188,nephron,nephron,UBERON:0001285,Loop of Henle (Thin Limb),descending thin limb of loop of Henle,UBERON:0001289,PMID: 31249312. PMCID: PMC6597610,DOI: 10.1038/s41467-019-10861-2,"CLDN10 low. no to low AQP1, SLC9A3, SLC4A11",,DOI: 10.1172/jci.insight.133267,,,DOI: 10.1152/ajprenal.2000.278.1.F52,"heterogenity in DTL1, DTL3 urea transporter and AQP1 in DTL2, DTL3",,DOI: 10.1681/ASN.2020010071,https://esbl.nhlbi.nih.gov/KTEA/,,,,,,
kidney,kidney,UBERON:0002113,nephron,nephron,UBERON:0001285,Tubules,nephron tubule,UBERON:0001231,Loop of Henle (Thin Limb),descending thin limb of loop of Henle,UBERON:0001289,descending thin limb of loop of Henle 2,,,Descending Thin Limb Cell Type 2,Descending Thin Limb Cell Type 2,CL:4030013,DTL2,New term added CL; CLDN10 low; CPE low,CRYAB,crystallin alpha B,HGNC:2389,,SLC39A8,,HGNC:20862,,TACSTD2,,HGNC:11530,,AQP1,,HGNC:633,SLC9A3,,SLC4A11,,HGNC:16438,,,,,,,,nephron,nephron,UBERON:0001285,Loop of Henle (Thin Limb),descending thin limb of loop of Henle,UBERON:0001289,,DOI: 10.1101/2021.07.28.454201,CLDN10 low; CPE low,PMID: 31689386,DOI: 10.1016/j.devcel.2019.10.005,https://cello.shinyapps.io/kidneycellexplorer/,,DOI: 10.1038/s41467-019-10861-2,general DTL marker,,DOI: 10.1681/ASN.2020010071,https://esbl.nhlbi.nih.gov/KTEA/,,DOI: 10.1152/ajprenal.2000.278.1.F52,"heterogenity in DTL1, DTL3 urea transporter and AQP1 in DTL2, DTL3",,,
kidney,kidney,UBERON:0002113,nephron,nephron,UBERON:0001285,Tubules,nephron tubule,UBERON:0001231,Loop of Henle (Thin Limb),descending thin limb of loop of Henle,UBERON:0001289,descending thin limb of loop of Henle 3,,,Descending Thin Limb Cell Type 3,Descending Thin Limb Cell Type 3,CL:4030014,DTL3,New term added CL; CLDN10 low; In inner medulla may see heterogeneity with AQP1 pos and SLC14A2 neg tubules. AQP1 may be absent in deep papilla near the bend of loop of Henle and SLC14A2 may be present in deep papilla,CRYAB,crystallin alpha B,HGNC:2389,,SLC14A2,,HGNC:10919,,TACSTD2,,HGNC:11530,,CLDN1,,HGNC:2032,SH3GL3,,HGNC:10832,SLC4A11,,HGNC:16438,CPE,,HGNC:2303,,,,nephron,nephron,UBERON:0001285,Loop of Henle (Thin Limb),descending thin limb of loop of Henle,UBERON:0001289,,DOI: 10.1101/2021.07.28.454201,CLDN10 low; from papilla; in inner medulla may see heterogeneity with AQP1 pos and SLC14A2 neg. AQP1 may be absent in deep papilla near the bend of loop of Henle,PMID: 31689386,DOI: 10.1016/j.devcel.2019.10.005,https://cello.shinyapps.io/kidneycellexplorer/,,DOI: 10.1038/s41467-019-10861-2,general DTL marker,https://pubmed.ncbi.nlm.nih.gov/10662724/,DOI: 10.1152/ajprenal.2000.278.2.F202,,,DOI: 10.1152/ajprenal.2000.278.1.F52,"heterogenity in DTL1, DTL3 urea transporter and AQP1 in DTL2, DTL3",,DOI: 10.1681/ASN.2020010071,https://esbl.nhlbi.nih.gov/KTEA/
kidney,kidney,UBERON:0002113,nephron,nephron,UBERON:0001285,Tubules,nephron tubule,UBERON:0001231,Loop of Henle (Thin Limb),ascending thin limb of loop of Henle,UBERON:0004193,,,,Ascending Thin Limb Cell,kidney loop of Henle thin ascending limb epithelial cell,CL:1001107,ATL,AQP1 absent,CRYAB,crystallin alpha B,HGNC:2389,,TACSTD2,,HGNC:11530,,CLDN3,,HGNC:2045,,SH3GL3,,HGNC:10832,PROX1,,HGNC:9459,CLCNKA,,HGNC:2026,,,,,,,nephron,nephron,UBERON:0001285,Loop of Henle (Thin Limb),ascending thin limb of loop of Henle,UBERON:0004193,PMID: 31249312. PMCID: PMC6597610,DOI: 10.1038/s41467-019-10861-2,"AQP1 low to none, also HUBMAP unpublished",PMID: 31689386,DOI: 10.1016/j.devcel.2019.10.005,https://cello.shinyapps.io/kidneycellexplorer/,,DOI: 10.1038/s41467-019-10861-2,,,,,,,,,,
kidney,kidney,UBERON:0002113,nephron,nephron,UBERON:0001285,Tubules,nephron tubule,UBERON:0001231,Loop of Henle (Thick Limb),thick ascending limb of loop of Henle,UBERON:0001291,,,,Thick Ascending Limb Cell,kidney loop of Henle thick ascending limb epithelial cell,CL:1001106,,SLC12A3 low to none,SLC12A1,solute carrier family 12 member 1,HGNC:10910,,UMOD,,HGNC:12559,,CASR,,HGNC:1514,,,,,,,,,,,,,,,,,nephron,nephron,UBERON:0001285,Loop of Henle (Thick Limb),thick ascending limb of loop of Henle,UBERON:0001291,PMID: 31249312. PMCID: PMC6597610,DOI: 10.1038/s41467-019-10861-2,SLC12A3 low to none,PMID: 31689386,DOI: 10.1016/j.devcel.2019.10.005,https://cello.shinyapps.io/kidneycellexplorer/,,DOI: 10.1038/s41467-019-10861-2,,,DOI: 10.1172/jci.insight.133267,,,DOI: 10.1038/s41586-020-2941-1,,,DOI: 10.1681/ASN.2020010071,https://esbl.nhlbi.nih.gov/KTEA/
kidney,kidney,UBERON:0002113,nephron,nephron,UBERON:0001285,Tubules,nephron tubule,UBERON:0001231,Loop of Henle (Thick Limb/Cortex),thick ascending limb of loop of Henle,UBERON:0001291,,,,Cortical Thick Ascending Limb Cell,kidney loop of Henle cortical thick ascending limb epithelial cell,CL:1001109,C-TAL,SLC12A3 low to none,SLC12A1,solute carrier family 12 member 1,HGNC:10910,,UMOD,,HGNC:12559,,CASR,,HGNC:1514,,TMEM207,,HGNC:33705,CLDN16,,HGNC:2037,,,,,,,,,,nephron,nephron,UBERON:0001285,Loop of Henle (Thick Limb/Cortex),thick ascending limb of loop of Henle,UBERON:0001291,PMID: 31249312. PMCID: PMC6597610,DOI: 10.1038/s41467-019-10861-2,SLC12A3 low to none,PMID: 31689386,DOI: 10.1016/j.devcel.2019.10.005,https://cello.shinyapps.io/kidneycellexplorer/,,DOI: 10.1038/s41467-019-10861-2,,,,,,DOI: 10.1681/ASN.2020010071,https://esbl.nhlbi.nih.gov/KTEA/,,,
kidney,kidney,UBERON:0002113,nephron,nephron,UBERON:0001285,Tubules,nephron tubule,UBERON:0001231,Loop of Henle (Thick Limb/Medulla),thick ascending limb of loop of Henle,UBERON:0001291,,,,Medullary Thick Ascending Limb Cell,kidney loop of Henle medullary thick ascending limb epithelial cell,CL:1001108,M-TAL,SLC12A3 low to none,SLC12A1,solute carrier family 12 member 1,HGNC:10910,,UMOD,,HGNC:12559,,CASR,,HGNC:1514,,RAP1GAP,,HGNC:9858,PROX1,,HGNC:9459,,,,,,,,,,nephron,nephron,UBERON:0001285,Loop of Henle (Thick Limb/Medulla),thick ascending limb of loop of Henle,UBERON:0001291,PMID: 31249312. PMCID: PMC6597610,DOI: 10.1038/s41467-019-10861-2,SLC12A3 low to none,PMID: 31689386,DOI: 10.1016/j.devcel.2019.10.005,https://cello.shinyapps.io/kidneycellexplorer/,,DOI: 10.1038/s41467-019-10861-2,,,DOI: 10.1172/jci.insight.133267,,,DOI: 10.1681/ASN.2020010071,https://esbl.nhlbi.nih.gov/KTEA/,,,
kidney,kidney,UBERON:0002113,nephron,nephron,UBERON:0001285,Tubules,nephron tubule,UBERON:0001231,Loop of Henle (Thick Limb/ Cortex),thick ascending limb of loop of Henle,UBERON:0001291,Macula Densa,macula densa,UBERON:0002335,Macula Densa cell,macula densa epithelial cell,CL:1000850,MD,MD is a collection of thick ascending limb specialized cells; UMOD low to none,SLC12A1,solute carrier family 12 member 1,HGNC:10910,,NOS1,,HGNC:7872,,ROBO2,,HGNC:10250,,,,,,,,,,,,,,,,,nephron,nephron,UBERON:0001285,Loop of Henle (Thick Limb/ Cortex),thick ascending limb of loop of Henle,UBERON:0001291,PMID: 31249312. PMCID: PMC6597610,DOI: 10.1038/s41467-019-10861-2,UMOD low to none,PMID: 31689386,DOI: 10.1016/j.devcel.2019.10.005,https://cello.shinyapps.io/kidneycellexplorer/,,DOI: 10.1681/ASN.2020010071,https://esbl.nhlbi.nih.gov/KTEA/,,,,,,,,,
kidney,kidney,UBERON:0002113,nephron,nephron,UBERON:0001285,Tubules,nephron tubule,UBERON:0001231,Distal Convolution,distal convoluted tubule,UBERON:0001292,,,,Distal Convoluted Tubule Cell,kidney distal convoluted tubule epithelial cell,CL:1000849,,,SLC12A3,solute carrier family 12 member 3,HGNC:10912,,TRPM6,,HGNC:17995,,CALB1,,HGNC:1434,,SALL3,,HGNC:10527,,,,,,,,,,,,,nephron,nephron,UBERON:0001285,Distal Convolution,distal convoluted tubule,UBERON:0001292,PMID: 31249312. PMCID: PMC6597610,DOI: 10.1038/s41467-019-10861-2,,,DOI: 10.1038/s41467-019-10861-2,,PMID: 32358040,DOI: 10.1681/ASN.2020010071,mouse proteomics,,DOI: 10.1681/ASN.2020010071,https://esbl.nhlbi.nih.gov/KTEA/,,,,,,
kidney,kidney,UBERON:0002113,nephron,nephron,UBERON:0001285,Tubules,nephron tubule,UBERON:0001231,Distal Convolution,distal convoluted tubule,UBERON:0001292,,,,Distal Convoluted Tubule Cell Type 1,distal convoluted tubule cell type 1,CL:4030016,DCT1,"New term added CL;SLC8A1, HSD11B2 (low to none) ",SLC12A3,solute carrier family 12 member 3,HGNC:10912,,TRPM6,,HGNC:17995,,,,,,,,,,,,,,,,,,,,,nephron,nephron,UBERON:0001285,Distal Convolution,distal convoluted tubule,UBERON:0001292,PMID: 31249312. PMCID: PMC6597610,DOI: 10.1038/s41467-019-10861-2,"SLC8A1, HSD11B2 (low to none)",,DOI: 10.1038/s41467-019-10861-2,,PMID: 32358040,DOI: 10.1681/ASN.2020010071,mouse proteomics,,DOI: 10.1681/ASN.2020010071,https://esbl.nhlbi.nih.gov/KTEA/,,,,,,
kidney,kidney,UBERON:0002113,nephron,nephron,UBERON:0001285,Tubules,nephron tubule,UBERON:0001231,Distal Convolution,distal convoluted tubule,UBERON:0001292,,,,Distal Convoluted Tubule Cell Type 2,distal convoluted tubule cell type 2,CL:4030017,DCT2,New term added CL; Has CNT and DCT signature,SLC12A3,solute carrier family 12 member 3,HGNC:10912,,SLC8A1,,HGNC:11068,,HSD11B2,,HGNC:5209,,CALB1,,HGNC:1434,SCNN1G,,HGNC:10602,TRPV5,,HGNC:3145,,,,,,,nephron,nephron,UBERON:0001285,Distal Convolution,distal convoluted tubule,UBERON:0001292,PMID: 31249312. PMCID: PMC6597610,DOI: 10.1038/s41467-019-10861-2,Has CNT and DCT signature,,DOI: 10.1038/s41467-019-10861-2,,PMID: 32358040,DOI: 10.1681/ASN.2020010071,mouse proteomics,,DOI: 10.1681/ASN.2020010071,https://esbl.nhlbi.nih.gov/KTEA/,,,,,,
kidney,kidney,UBERON:0002113,nephron,nephron,UBERON:0001285,Tubules,nephron tubule,UBERON:0001231,Connecting Tubule,connecting tubule,UBERON:0005097,,,,Connecting Tubule Cell,kidney connecting tubule epithelial cell,CL:1000768,CNT,SLC12A3 low to none. IC or PC without SLC8A1 could be in the CNT structure,SLC8A1,solute carrier family 8 member A1,HGNC:11068,,CALB1,,HGNC:1434,,TRPV5,,HGNC:3145,,GATA3,,HGNC:4172,HSD11B2,,HGNC:5209,SCNN1G,,HGNC:10602,SCN2A,,,,,,nephron,nephron,UBERON:0001285,,,,PMID: 31249312. PMCID: PMC6597610,DOI: 10.1038/s41467-019-10861-2,SLC12A3 low to none. IC or PC without SLC8A1 could be in the CNT structure,,DOI: 10.1038/s41467-019-10861-2,,PMID: 32358040,DOI: 10.1681/ASN.2020010071,mouse proteomics,,DOI: 10.1681/ASN.2020010071,https://esbl.nhlbi.nih.gov/KTEA/,,,,,,
kidney,kidney,UBERON:0002113,nephron,nephron,UBERON:0001285,Tubules,nephron tubule,UBERON:0001231,Connecting Tubule,connecting tubule,UBERON:0005097,,,,Connecting Tubule Principal Cell,connecting tubule principal cell,CL:4030018,CNT-PC,New term added CL,AQP2,aquaporin 2,HGNC:634,,AQP3,,HGNC:636,,FXYD4,,HGNC:4028,,SCNN1G,,HGNC:10602,,,,,,,,,,,,,nephron,nephron,UBERON:0001285,,,,PMID: 31249312. PMCID: PMC6597610,DOI: 10.1038/s41467-019-10861-2,,,DOI: 10.1038/s41467-019-10861-2,,PMID: 32358040,DOI: 10.1681/ASN.2020010071,mouse proteomics,,,,,DOI: 10.1038/s41586-020-2941-1,,,,
kidney,kidney,UBERON:0002113,nephron,nephron,UBERON:0001285,Tubules,nephron tubule,UBERON:0001231,Connecting Tubule,connecting tubule,UBERON:0005097,,,,Connecting Tubule Intercalated Cell,connecting tubule intercalated cell,CL:4030019,,New term added CL,CA2,carbonic anhydrase 2,HGNC:1373,,ATP6V0D2,,HGNC:18266,,SLC8A1,,HGNC:11068,,,,,,,,,,,,,,,,,nephron,nephron,UBERON:0001285,,,,PMID: 31249312. PMCID: PMC6597610,DOI: 10.1038/s41467-019-10861-2,,,DOI: 10.1038/s41467-019-10861-2,,PMID: 32358040,DOI: 10.1681/ASN.2020010071,mouse proteomics,,DOI: 10.1038/s41586-020-2941-1,,,,,,,
